<!ELEMENT nodos (nodo+)>
<!ELEMENT nodo (nodo*)>
<!ATTLIST nodo id ID #IMPLIED>
<!ATTLIST nodo nodoAdyacente IDREF #IMPLIED>
<!ATTLIST nodo distancia NMTOKEN #IMPLIED>
